{
  "$schema": "../schemas/release-compatibility.schema.json",
  "manifest_version": "1.0.0",
  "release_version": "1.0.0",
  "runtime": {
    "go": {
      "module": "github.com/luisdourado/invs",
      "version": "1.24.0"
    },
    "python": {
      "version": "3.13.15",
      "package": "invs-research",
      "package_version": "0.1.0",
      "requires_python": ">=3.12",
      "dependencies": {
        "duckdb": "1.5.5",
        "jupyterlab": "4.6.3",
        "pandas": "2.3.3",
        "pyarrow": "21.0.0",
        "pyyaml": "6.0.3"
      },
      "dev_dependencies": {
        "pytest": "8.4.2",
        "ruff": "0.16.5"
      }
    },
    "postgres": {
      "major": "17"
    },
    "grafana": {
      "version": "12.1.0"
    },
    "docker": {
      "compose_version": "5.3.1"
    }
  },
  "images": [
    {
      "service": "collector-build",
      "reference": "golang:1.24-alpine",
      "digest": "sha256:8bee1901f1e530bfb4a7850aa7a479d17ae3a18beb6e09064ed54cfd245b7191",
      "source_path": "docker/collector.Dockerfile"
    },
    {
      "service": "collector-runtime",
      "reference": "alpine:3.22",
      "digest": "sha256:14358309a308569c32bdc37e2e0e9694be33a9d99e68afb0f5ff33cc1f695dce",
      "source_path": "docker/collector.Dockerfile"
    },
    {
      "service": "jupyter",
      "reference": "python:3.13-slim",
      "digest": "sha256:7ce4b6dfe35e55397b7cda544f8a13f191b7ae28dc5aad71fe664dbc9bc2623f",
      "source_path": "docker/jupyter.Dockerfile"
    },
    {
      "service": "postgres",
      "reference": "postgres:17-alpine",
      "digest": "sha256:742f40ea20b9ff2ff31db5458d127452988a2164df9e17441e191f3b72252193",
      "source_path": "docker/postgres.Dockerfile"
    },
    {
      "service": "grafana",
      "reference": "grafana/grafana:12.1.0",
      "digest": "sha256:6ac590e7cabc2fbe8d7b8fc1ce9c9f0582177b334e0df9c927ebd9670469440f",
      "source_path": "docker-compose.yml"
    }
  ],
  "contracts": {
    "schemas": [
      {
        "name": "backtest-checkpoint",
        "path": "schemas/backtest-checkpoint.schema.json",
        "schema_version": "1.0.0",
        "sha256": "14f88156962a871bffca091d3d4d4ce4b1204defe69b08c83bb301cf61d64133"
      },
      {
        "name": "backtest-experiment",
        "path": "schemas/backtest-experiment.schema.json",
        "schema_version": "1.0.0",
        "sha256": "a89b14a76e57ff48545796b5f00defc24df33a9bd1a0b406b873d9aa1ac4cefd"
      },
      {
        "name": "backtest-fill",
        "path": "schemas/backtest-fill.schema.json",
        "schema_version": "none",
        "sha256": "8b4d58a5bfefb7bfc6b1a535f9b53a0ebe715c22cbda30119e4c6326e6876acb"
      },
      {
        "name": "backtest-holding",
        "path": "schemas/backtest-holding.schema.json",
        "schema_version": "none",
        "sha256": "250fe4c4d896f4f2dd947df086ab385317b2ae90b2739ab6cb5dee912636312c"
      },
      {
        "name": "backtest-input",
        "path": "schemas/backtest-input.schema.json",
        "schema_version": "1.0.0",
        "sha256": "d125a25dbd14b26a7798d426e93e7250b5897b0fb6d4a599fd925710ec43dae8"
      },
      {
        "name": "backtest-ledger",
        "path": "schemas/backtest-ledger.schema.json",
        "schema_version": "none",
        "sha256": "47b637b268449e6d30d49ef4c3f45908ec7fe661d0e0aa52abd61809432f4abb"
      },
      {
        "name": "backtest-metrics",
        "path": "schemas/backtest-metrics.schema.json",
        "schema_version": "1.0.0",
        "sha256": "4a81b5cda7458c52be2ea47c810d85c28efe923af5d839724270078351ffeca7"
      },
      {
        "name": "backtest-nav",
        "path": "schemas/backtest-nav.schema.json",
        "schema_version": "none",
        "sha256": "5934b1da025815251ea74f97835dc61090c1534642abae8bf7de09dab836dbc3"
      },
      {
        "name": "backtest-order",
        "path": "schemas/backtest-order.schema.json",
        "schema_version": "none",
        "sha256": "a6c4fb8f87b67fa14a460924c852873c77132c7ba5d5d4c7807ef0a93be7bef9"
      },
      {
        "name": "backtest-result",
        "path": "schemas/backtest-result.schema.json",
        "schema_version": "1.0.0",
        "sha256": "96f33788907d464143409ecee9dff99b9df3ee6e1fc6b28712a990ca17bc6f5e"
      },
      {
        "name": "calendar-manifest",
        "path": "schemas/calendar-manifest.schema.json",
        "schema_version": "1.0.0",
        "sha256": "f06878d8f3ae40cd90b3b44c21005bf466ffa91f865a2ae033f89310532b26ab"
      },
      {
        "name": "corporate-action",
        "path": "schemas/corporate-action.schema.json",
        "schema_version": "2.0.0",
        "sha256": "0f5ac06fae640f934dec2aff8385481d8485c615e133d842967d2270b48e93bc"
      },
      {
        "name": "daily-cycle",
        "path": "schemas/daily-cycle.schema.json",
        "schema_version": "1.2.0",
        "sha256": "e0ea510b868683a9e11bdad69c2930c6a16b0e699888b9436980cfadef2a135e"
      },
      {
        "name": "daily-cycle-report",
        "path": "schemas/daily-cycle-report.schema.json",
        "schema_version": "1.2.0",
        "sha256": "c276071e8548741d93edc00679aaca0efb671820f14202fbecbc03928fb7a826"
      },
      {
        "name": "data-source",
        "path": "schemas/data-source.schema.json",
        "schema_version": "1.0.0",
        "sha256": "1a87b5d1e1bc8c0db58379a02e4d9a8e88aad893a46f7957867a61e11f8bbb8d"
      },
      {
        "name": "data-fitness-matrix",
        "path": "schemas/data-fitness-matrix.schema.json",
        "schema_version": "none",
        "sha256": "1613a629acdeca53375c62666cfea330a7047ee569d9be75761388e2d52a6232"
      },
      {
        "name": "discovery-index",
        "path": "schemas/discovery-index.schema.json",
        "schema_version": "1.0.0",
        "sha256": "ebe922d663d82298a728dd2fca956743408e2e3a3e7c08d05f56a84700e1c521"
      },
      {
        "name": "economic-observation",
        "path": "schemas/economic-observation.schema.json",
        "schema_version": "1.0.0",
        "sha256": "f0bbc3e7a6209bc0b832c5f5cd7635f2ed17f6bbcc8d0ea6648add0434d09345"
      },
      {
        "name": "feature-batch-manifest",
        "path": "schemas/feature-batch-manifest.schema.json",
        "schema_version": "1.0.0",
        "sha256": "1349b396b8d5520103cd2f7171efa23e049ab5e759ac3fb1a518ca289c7f4fa5"
      },
      {
        "name": "feature-catalog-report",
        "path": "schemas/feature-catalog-report.schema.json",
        "schema_version": "none",
        "sha256": "99e34a81b7840f1b2cc5fcbe873d389387ec6fad0f9607bb24dc97bdb12ba3e4"
      },
      {
        "name": "feature-fundamental-manifest",
        "path": "schemas/feature-fundamental-manifest.schema.json",
        "schema_version": "1.1.0",
        "sha256": "763fea0e3af2bc3a3e6eece1d0e20c904abf9bff3f58031a7c421a58de6f3400"
      },
      {
        "name": "feature-fundamental-observation",
        "path": "schemas/feature-fundamental-observation.schema.json",
        "schema_version": "1.1.0",
        "sha256": "a575f01274ed3729cd250c9d097e512262327e4679559012cb922a24034e9dad"
      },
      {
        "name": "feature-macro-manifest",
        "path": "schemas/feature-macro-manifest.schema.json",
        "schema_version": "1.1.0",
        "sha256": "b586eb70d74d11db55415d137e45f057e12f79d2cb1a6ff62d2022d9c1deeb35"
      },
      {
        "name": "feature-macro-observation",
        "path": "schemas/feature-macro-observation.schema.json",
        "schema_version": "1.1.0",
        "sha256": "dc20bd24e1bd76f7115e6c3d8d3a94954f5c4fd4ec4f99951cd22201fb5909b7"
      },
      {
        "name": "feature-manifest",
        "path": "schemas/feature-manifest.schema.json",
        "schema_version": "1.1.0",
        "sha256": "a0312cfb224f19c06e6153c9556b061d0070e81666b6227d54cf000f453b7dcb"
      },
      {
        "name": "feature-momentum-manifest",
        "path": "schemas/feature-momentum-manifest.schema.json",
        "schema_version": "1.1.0",
        "sha256": "ba5f981c7f6e711c44a56400f138d33151e6cdc3280ad60d75f882b5a150222e"
      },
      {
        "name": "feature-momentum-observation",
        "path": "schemas/feature-momentum-observation.schema.json",
        "schema_version": "1.1.0",
        "sha256": "f266cbc5fbdbc2052f5d42435ff589ace63017fb8a802d4ec273f33c0635d1b2"
      },
      {
        "name": "feature-observation",
        "path": "schemas/feature-observation.schema.json",
        "schema_version": "1.1.0",
        "sha256": "be275ddd50949bd19eca3506b2de175d0e3cc5a98f4c72e634f0cf904710d68f"
      },
      {
        "name": "feature-quality-report",
        "path": "schemas/feature-quality-report.schema.json",
        "schema_version": "none",
        "sha256": "fe78207fa4f319fffe08ea077ec1aef8c4eff3d483973b8d8e16fd58081ae667"
      },
      {
        "name": "feature-set-registry",
        "path": "schemas/feature-set-registry.schema.json",
        "schema_version": "none",
        "sha256": "4c37196457af323c867a528156a933e672a22f229ce456ee7b8a7ff04ff6ab25"
      },
      {
        "name": "feature-taxonomy-registry",
        "path": "schemas/feature-taxonomy-registry.schema.json",
        "schema_version": "none",
        "sha256": "3ad6e2946c2c50b1d572010c9b04989eda44fc224f5132e48fdcee2a1c5dbb70"
      },
      {
        "name": "filing",
        "path": "schemas/filing.schema.json",
        "schema_version": "1.0.0",
        "sha256": "3c699202b5b480446836f9b65c558e59084c66a405e20862cd7f39765057ed37"
      },
      {
        "name": "fundamental-observation",
        "path": "schemas/fundamental-observation.schema.json",
        "schema_version": "1.0.0",
        "sha256": "52af36a55a61d58e598eda57041625b78bc73bf1a1d8a0f90d2e3bcd2592aefc"
      },
      {
        "name": "fx-observation",
        "path": "schemas/fx-observation.schema.json",
        "schema_version": "1.0.0",
        "sha256": "b56fca807953adbf62b10e9b2320802e81201117adfc98f7a65392b595018ad3"
      },
      {
        "name": "ingestion-run",